user_id,user_category,recommended_category,expected_reward,article_headline
U6830,user_2,EDUCATION,4.631475609413305,'What’s A White B*tch Like You Doing In A School Like This?'
U0768,user_2,EDUCATION,4.631475609413305,Louisiana Has A Five-Year-Old 'Parent Trigger' Law That No Parent Has Ever Used
U3576,user_2,EDUCATION,4.631475609413305,Focusing on Closing the Gender Gap in School Shootings
U3318,user_2,EDUCATION,4.631475609413305,Why The Strategy To End Discrimination Against Asian Americans in Admissions Is All Wrong
U3393,user_2,EDUCATION,4.631475609413305,Billionaire Charter School Leader Says Black Politician Worse Than the KKK
U8314,user_2,EDUCATION,4.631475609413305,Why Our Kids Don't Love School Anymore
U0278,user_2,EDUCATION,4.631475609413305,Converted City Bus Brings Education To The Hardest-to-Reach Students
U1955,user_2,EDUCATION,4.631475609413305,The Global Search for Education:  Top Global Teacher Bloggers - The Best Holiday Gifts for Your Students
U2725,user_2,EDUCATION,4.631475609413305,The Controversial Way Some California Schools Are Handling Students' Misbehavior
U8799,user_2,EDUCATION,4.631475609413305,Education Reform and Evidence
U9788,user_2,EDUCATION,4.631475609413305,Teachers Union President Joins Anti-Union Operative To Praise Charter Schools
U0453,user_2,EDUCATION,4.631475609413305,Lifelong Learners in a Rapidly Changing World
U1748,user_2,EDUCATION,4.631475609413305,Why Journalists Shouldn't Write About Education
U2741,user_2,EDUCATION,4.631475609413305,"Teach, Stream, Be Acquired: Why Online Education Investors Are Hot for Teacher"
U8809,user_2,EDUCATION,4.631475609413305,Ohio Charter E-Schools Under Investigation
U0405,user_2,EDUCATION,4.631475609413305,Why More School Districts Are Holding Class Just Four Days A Week
U4135,user_2,EDUCATION,4.631475609413305,Proficient?
U2658,user_2,EDUCATION,4.631475609413305,'What’s A White B*tch Like You Doing In A School Like This?'
U8403,user_2,EDUCATION,4.631475609413305,5 Student Loan Tips for Recent College Graduates
U8364,user_2,EDUCATION,4.631475609413305,Why The Strategy To End Discrimination Against Asian Americans in Admissions Is All Wrong
U8978,user_2,EDUCATION,4.631475609413305,Mindful Final Exams?
U4123,user_2,EDUCATION,4.631475609413305,"60 Years After Brown v. Board, Will Congress Revive A Dual School System?"
U7016,user_2,EDUCATION,4.631475609413305,Your Student Loan Refinancing Questions Answered
U0139,user_2,EDUCATION,4.631475609413305,"To Teach The Whole Child, Schools Need Recess"
U4090,user_2,EDUCATION,4.631475609413305,Opt Outers Face Confusing Summer
U4328,user_2,EDUCATION,4.631475609413305,Homage to My Teachers
U7606,user_2,EDUCATION,4.631475609413305,Education Reformers Keep Saying They Want to Pay Teachers More -- Do They Mean It?
U1195,user_2,EDUCATION,4.631475609413305,In Case You Don't Know What Great Teaching Looks Like
U0061,user_2,EDUCATION,4.631475609413305,Letter to Jenny
U4644,user_2,EDUCATION,4.631475609413305,A Tree Without Roots: Astroturf and Corporate Education Reform
U3984,user_2,EDUCATION,4.631475609413305,Making Evidence Primary for Secondary Readers
U3868,user_2,EDUCATION,4.631475609413305,Mr. MacPherson Circa 1982
U2682,user_2,EDUCATION,4.631475609413305,A Teacher's Unlikely Crush (on an eReader)
U5266,user_2,EDUCATION,4.631475609413305,Why The Strategy To End Discrimination Against Asian Americans in Admissions Is All Wrong
U4955,user_2,EDUCATION,4.631475609413305,In Case You Don't Know What Great Teaching Looks Like
U5745,user_2,EDUCATION,4.631475609413305,Job Insecurity: The False Dilemma of Teacher Tenure
U1410,user_2,EDUCATION,4.631475609413305,"To Teach The Whole Child, Schools Need Recess"
U3279,user_2,EDUCATION,4.631475609413305,In Case You Don't Know What Great Teaching Looks Like
U5483,user_2,EDUCATION,4.631475609413305,Trinity Lutheran v. Comer: 7 Things To Know About A SCOTUS Preschool Case With Big School Choice Implications
U2566,user_2,EDUCATION,4.631475609413305,Charter Schools Are Scamming The Public With Talk About 'School Choice'
U3431,user_2,EDUCATION,4.631475609413305,What Every Parent Needs to Know About Their Schools
U9185,user_2,EDUCATION,4.631475609413305,Education Reform and Evidence
U2394,user_2,EDUCATION,4.631475609413305,"Teachers Swarm Kentucky Capitol To Protest Pension Changes, School Budget Cuts"
U5073,user_2,EDUCATION,4.631475609413305,Why Our Kids Don't Love School Anymore
U0903,user_2,EDUCATION,4.631475609413305,The Global Search for Education: From New Zealand
U9537,user_2,EDUCATION,4.631475609413305,Of Teachers and Educational Technology
U1014,user_2,EDUCATION,4.631475609413305,"Owner Of Troubled, Closed Texas College Now Advises Another For-Profit School"
U5608,user_2,EDUCATION,4.631475609413305,"EduScholar Rankings: Where Education Policy Should Be Going, Versus Where It Is"
U5684,user_2,EDUCATION,4.631475609413305,"Data, Numbers, Education And Audiences"
U6556,user_2,EDUCATION,4.631475609413305,The Compelling Need to Improve the Higher Education Value Equation
U3574,user_2,EDUCATION,4.631475609413305,Mr. MacPherson Circa 1982
U3830,user_2,EDUCATION,4.631475609413305,Broken Systems Created #Ferguson. Educating People Can Help Fix It.
U2542,user_2,EDUCATION,4.631475609413305,The Return to Basics in Education. Did We Ever Leave?
U0637,user_2,EDUCATION,4.631475609413305,Why Won't Arne Duncan and Other True Believers in High-Stakes Testing Face Reality?
U5916,user_2,EDUCATION,4.631475609413305,An Homage to 'Teachers'
U5403,user_2,EDUCATION,4.631475609413305,A Better Way to Spend $60 Billion? Expand Pell Grants
U6262,user_2,EDUCATION,4.631475609413305,The Global Search for Education:  With the World in Mind
U0869,user_2,EDUCATION,4.631475609413305,Is Paris Burning?
U4288,user_2,EDUCATION,4.631475609413305,Study Shows How Screen Time Can Improve Your Toddler's Reading Comprehension
U6698,user_2,EDUCATION,4.631475609413305,Welcome Back To School: Listen To The Teachers
U4850,user_2,EDUCATION,4.631475609413305,Poor And Middle-Income Families Need A Better Way Than 529s To Save For College
U4958,user_2,EDUCATION,4.631475609413305,"Teachers Swarm Kentucky Capitol To Protest Pension Changes, School Budget Cuts"
U7767,user_2,EDUCATION,4.631475609413305,The Graduation Gift You Can't Afford to Miss
U7972,user_2,EDUCATION,4.631475609413305,Will Justin Bieber Become a Teacher?
U6836,user_2,EDUCATION,4.631475609413305,"We Salute You, Gwen Morgan"
U0894,user_2,EDUCATION,4.631475609413305,Attorneys General Sue Over DeVos' Handling Of For-Profit Colleges
U2938,user_2,EDUCATION,4.631475609413305,What Do We Do With The Flat Earthers?
U2319,user_2,EDUCATION,4.631475609413305,"Democracy Requires Citizenship Education, Now More Than Ever"
U6072,user_2,EDUCATION,4.631475609413305,The Graduation Gift You Can't Afford to Miss
U2268,user_2,EDUCATION,4.631475609413305,Why Rescue the Latest Failed 'Chief for Change'?
U9870,user_2,EDUCATION,4.631475609413305,Around the World in 30 Days - December 2014
U2456,user_2,EDUCATION,4.631475609413305,Five Questions for LaVerne Evans Srinivasan
U2590,user_2,EDUCATION,4.631475609413305,"An Interview with a Revolutionary, Professor Peter McLaren"
U3106,user_2,EDUCATION,4.631475609413305,I Am A Public School Teacher. Give Me All The Refugees You’ve Got!
U6380,user_2,EDUCATION,4.631475609413305,Education Reformers Are So Gullible
U6399,user_2,EDUCATION,4.631475609413305,What Did We Learn From The Betsy DeVos Confirmation? Money Wins.
U3409,user_2,EDUCATION,4.631475609413305,Why Grammar Is Important
U5579,user_2,EDUCATION,4.631475609413305,Racist Bullying Needs to Stop: We Cannot Become Desensitized to 10-Year-Olds Hanging Themselves
U1061,user_2,EDUCATION,4.631475609413305,Judge Rules Latest Pearson/NYSED Test Does Not Discriminate -- So Far
U8483,user_2,EDUCATION,4.631475609413305,Answering Eisenhower’s Call
U7980,user_2,EDUCATION,4.631475609413305,What to Do if it Feels Like You Are Running Out of Time on Your SAT/ACT Test Prep
U8030,user_2,EDUCATION,4.631475609413305,"The Global Search for Education: The Rich, the Poor and What the World's Millennials Think"
U4019,user_2,EDUCATION,4.631475609413305,Dear Educators: Your Voice Matters
U3796,user_2,EDUCATION,4.631475609413305,"Graduation Rates Are Rising, but Too Many Students Are Still Falling Behind"
U7865,user_2,EDUCATION,4.631475609413305,Chuck E. Cheese’s Now Offers 'Sensory Sensitive Sundays' For Special Needs Children
U1571,user_2,EDUCATION,4.631475609413305,"MakeSchool Co-Founder Ashu Desai Talks about, ""The Computer Science Degree of the Future"""
U3374,user_2,EDUCATION,4.631475609413305,Welcome Back To School: Listen To The Teachers
U1739,user_2,EDUCATION,4.631475609413305,No Excuse Teaching
U5185,user_2,EDUCATION,4.631475609413305,Eileen Soon: The future of special education is exciting if we dare to reimagine it
U2081,user_2,EDUCATION,4.631475609413305,Early Education Can Bring Back The Best Of Ourselves
U8744,user_2,EDUCATION,4.631475609413305,No Equal in the World: Leadership Advice for New College Presidents
U2874,user_2,EDUCATION,4.631475609413305,Psychology Superheroes in a California School District
U5709,user_2,EDUCATION,4.631475609413305,First Job Blues: Battles and Lifelong Lessons
U1084,user_2,EDUCATION,4.631475609413305,Are Publicly Funded Charter Schools Accountable to Parents and Taxpayers? Apparently Not.
U2677,user_2,EDUCATION,4.631475609413305,"As Schools Adopt Social-Emotional Programs, A New Harvard Guide Offers Help"
U4253,user_2,EDUCATION,4.631475609413305,No Excuse Teaching
U5969,user_2,EDUCATION,4.631475609413305,Good Habits Live Long
U0600,user_2,EDUCATION,4.631475609413305,Happy Birthday America
U4182,user_2,EDUCATION,4.631475609413305,Should I Switch My Student Loan To a Variable Interest Rate?
U5941,user_2,EDUCATION,4.631475609413305,Do Millennials Have Good Money Habits?
U5232,user_2,EDUCATION,4.631475609413305,"New Course Leads To Big Gains In Number Of Girls, Minorities Taking AP Computer Science Exams"
U1128,user_2,EDUCATION,4.631475609413305,Testing: Enhanced Interrogation in the Classroom
U5450,user_2,EDUCATION,4.631475609413305,Our Students. Their Moment. My A**!
U4110,user_2,EDUCATION,4.631475609413305,"What Does ""Where's Waldo"" Have in Common With the Nation's Main Education Law?"
U7942,user_2,EDUCATION,4.631475609413305,The Global Search for Education: How to Lead Well
U3295,user_2,EDUCATION,4.631475609413305,"In Annual Newsletter, Gates Goes Silent On Education"
U5872,user_2,EDUCATION,4.631475609413305,Donald J. Trump’s 'Vision' For Education
U7847,user_2,EDUCATION,4.631475609413305,Kids in Montana Unique: They're Learning the Truth
U5284,user_2,EDUCATION,4.631475609413305,Higher Ed Slims Down
U8568,user_2,EDUCATION,4.631475609413305,The Global Search for Education: Being Global - A Global Competence Certificate
U9734,user_2,EDUCATION,4.631475609413305,My Son Only Read One Book in Middle School
U7155,user_2,EDUCATION,4.631475609413305,I Am A Public School Teacher. Give Me All The Refugees You’ve Got!
U9175,user_2,EDUCATION,4.631475609413305,A Good Start for Schools and Students
U0000,user_2,EDUCATION,4.631475609413305,"On My First Friend, Kindergarten, And Diversity"
U3496,user_2,EDUCATION,4.631475609413305,Vergara v. California Decision: Teacher Tenure Is Not the Problem
U5457,user_2,EDUCATION,4.631475609413305,Bringing the Wonder Back to Alice
U2955,user_2,EDUCATION,4.631475609413305,Why Doesn't the New York Times Understand the Controversy Over Common Core?
U8262,user_2,EDUCATION,4.631475609413305,The Global Search for Education: From Shanghai
U3391,user_2,EDUCATION,4.631475609413305,University Of Wisconsin-Inferior
U2428,user_2,EDUCATION,4.631475609413305,New Mexico Charter School CEO Steals Public Money For 15 Years. How’s That For Oversight?
U9358,user_2,EDUCATION,4.631475609413305,Back to the Future?
U4741,user_2,EDUCATION,4.631475609413305,Can We Learn to Get Along?
U8521,user_2,EDUCATION,4.631475609413305,Don't Bother With Yale: Even the Most Excellent Sheep are Still Part of a Herd
U4299,user_2,EDUCATION,4.631475609413305,What My Students Think Is The Best Way to Engage Students
U7451,user_2,EDUCATION,4.631475609413305,A Career Path for Every Great Teacher
U1113,user_2,EDUCATION,4.631475609413305,Giving Teenagers Weapons is NEVER a Solution
U7847,user_2,EDUCATION,4.631475609413305,Three Black Heroines: Thoughts On Race Relations
U0122,user_2,EDUCATION,4.631475609413305,My Son Only Read One Book in Middle School
U8075,user_2,EDUCATION,4.631475609413305,Grade-Span Tests Are Not the Answer
U4917,user_2,EDUCATION,4.631475609413305,Leveling the Playing Field for Our Kids
U2701,user_2,EDUCATION,4.631475609413305,Michigan Schools: An Example Of Needed Vigilance Nationwide
U4271,user_2,EDUCATION,4.631475609413305,"An Interview with a Revolutionary, Professor Peter McLaren"
U3023,user_2,EDUCATION,4.631475609413305,Promposal: the Movie
U9166,user_2,EDUCATION,4.631475609413305,"Misconception Monday: Viruses Are Not Omnipotent, Part 2"
U4372,user_2,EDUCATION,4.631475609413305,Brainstorming Middle School
U0906,user_2,EDUCATION,4.631475609413305,Doing It Yourself: From Independent Learning Plans to Organizing Your Instructional Path
U4867,user_2,EDUCATION,4.631475609413305,College Ready Baloney
U6095,user_2,EDUCATION,4.631475609413305,The Practical Liberal Arts
U1714,user_2,EDUCATION,4.631475609413305,What My Students Think Is The Best Way to Engage Students
U6203,user_2,EDUCATION,4.631475609413305,"Inspired By Skid Row, Educator Opening Charter To Help LA's Homeless Children And Families"
U6545,user_2,EDUCATION,4.631475609413305,Professor Watchlist: Who Is Being Targeted
U1543,user_2,EDUCATION,4.631475609413305,3 Reasons Why You Should Never Send a Kid to a Dictionary to Look Up the Spelling of a Word
U0947,user_2,EDUCATION,4.631475609413305,A Striking Number Of College Students Are Hungry And Homeless
U7867,user_2,EDUCATION,4.631475609413305,Experts: The White House Plan to Rate Colleges Has Major Issues
U2126,user_2,EDUCATION,4.631475609413305,"Vergara Identified A Few Real Problems, But It's Completely Wrong About The Solutions"
U3112,user_2,EDUCATION,4.631475609413305,A Career Path for Every Great Teacher
U8530,user_2,EDUCATION,4.631475609413305,"Just Put My Degree In The Mail! -- Notre Dame And Bethune-Cookman, Class Of 2017"
U8803,user_2,EDUCATION,4.631475609413305,Shakira and Massachusetts Mayor Agree: Learning English Critical for Immigrants
U4721,user_2,EDUCATION,4.631475609413305,A Teacher's Unlikely Crush (on an eReader)
U4495,user_2,EDUCATION,4.631475609413305,Thinking at Harvard: What Is the Future of Learning?
U6310,user_2,EDUCATION,4.631475609413305,Why More School Districts Are Holding Class Just Four Days A Week
U5946,user_2,EDUCATION,4.631475609413305,"How the ""Billionaire Boys Club"" Shaped Education in 2014"
U9428,user_2,EDUCATION,4.631475609413305,"Reflections of an Octogenarian: Educational Reform, or Stop Me if You've Heard This One Before"
U1248,user_2,EDUCATION,4.631475609413305,How The State Of Education Will Affect The Global Landscape:  Let's Prepare the United States For A Future Ready Movement
U6419,user_2,EDUCATION,4.631475609413305,Welcome to the PAGE2Ferguson Blog Salon
U6409,user_2,EDUCATION,4.631475609413305,A Choosy Mom on Choosing Schools
U7243,user_2,EDUCATION,4.631475609413305,Three Black Heroines: Thoughts On Race Relations
U4916,user_2,EDUCATION,4.631475609413305,New Orleans Charter Operator Bails; Surplus Laptops Sold Bearing Student Data
U8298,user_2,EDUCATION,4.631475609413305,Why Does Congress Want To Take $250 From Every Teacher?
U7154,user_2,EDUCATION,4.631475609413305,Youth Empowerment Matters
U0551,user_2,EDUCATION,4.631475609413305,The Chapel Hill Shooting: Why Our Lives Depend on Closing the Global Achievement Gap
U3022,user_2,EDUCATION,4.631475609413305,"At National Charter Conference, The Numbers Add Up -- Except When They Don't"
U9608,user_2,EDUCATION,4.631475609413305,Where All the Teachers Are Above Aveage
U9190,user_2,EDUCATION,4.631475609413305,"EduScholar Rankings: Where Education Policy Should Be Going, Versus Where It Is"
U5094,user_2,EDUCATION,4.631475609413305,Podcast: Students Say 'We Don't Want to Become Robots'
U1064,user_2,EDUCATION,4.631475609413305,I Am A Public School Teacher. Give Me All The Refugees You’ve Got!
U6557,user_2,EDUCATION,4.631475609413305,Deferred? 5 Powerful Tips to Getting Accepted at Your Top Choice School
U3842,user_2,EDUCATION,4.631475609413305,The Alt-Right Curriculum
U8447,user_2,EDUCATION,4.631475609413305,Newark Schools Still Struggling Despite Facebook Donation
U6210,user_2,EDUCATION,4.631475609413305,Newark Schools Still Struggling Despite Facebook Donation
U2388,user_2,EDUCATION,4.631475609413305,Kids First! Be a #KidVoter
U3040,user_2,EDUCATION,4.631475609413305,"Thank a Teacher Thursday: Dominic Casulli and the Power of Encouragement, Part 1"
U6980,user_2,EDUCATION,4.631475609413305,It's Proven. It's Perfect. I'll Change It.
U7967,user_2,EDUCATION,4.631475609413305,Young People Must Know Their Own History
U4496,user_2,EDUCATION,4.631475609413305,"Literacy for All, Yes! The New Literacy"
U8996,user_2,EDUCATION,4.631475609413305,Beyond Principals: Leadership Assessment Tools for All Educators
U6198,user_2,EDUCATION,4.631475609413305,Should Teachers Stop Fighting for Tenure?
U3017,user_2,EDUCATION,4.631475609413305,Trumpism Enters Schools When School Officials Become The Bullies
U3012,user_2,EDUCATION,4.631475609413305,One Reason #WhyHostingMatters: Volunteerism Makes Communities Stronger
U5647,user_2,EDUCATION,4.631475609413305,America's Charter Schools Have A Commitment Problem
U9129,user_2,EDUCATION,4.631475609413305,"Netflix, Disney And School Choice"
U4914,user_2,EDUCATION,4.631475609413305,Education Reformers Keep Saying They Want to Pay Teachers More -- Do They Mean It?
U7483,user_2,EDUCATION,4.631475609413305,Teaching About Totality and about Charlottesville
U5185,user_2,EDUCATION,4.631475609413305,Learning From Failure
U4214,user_2,EDUCATION,4.631475609413305,Pennsylvania School District Arms 500 Teachers With Mini Baseball Bats
U9805,user_2,EDUCATION,4.631475609413305,The End of Reading in America and Other Related Matters
U1660,user_2,EDUCATION,4.631475609413305,Proficient?
U9951,user_2,EDUCATION,4.631475609413305,New York Governor Unveils Plan To Help Lower Income Students Afford College
U8420,user_2,EDUCATION,4.631475609413305,Your Student Loan Refinancing Questions Answered
U8627,user_2,EDUCATION,4.631475609413305,The Compelling Need to Improve the Higher Education Value Equation
U8827,user_2,EDUCATION,4.631475609413305,5 Ways to Reduce Your Graduate School Student Debt
U2727,user_2,EDUCATION,4.631475609413305,Louisiana Has A Five-Year-Old 'Parent Trigger' Law That No Parent Has Ever Used
U5170,user_2,EDUCATION,4.631475609413305,The Importance of Process in Achieving Results
U7745,user_2,EDUCATION,4.631475609413305,I’m A Liberal Professor And My Conservative Students Terrify Me
U8199,user_2,EDUCATION,4.631475609413305,California Law Spurs Reforms After High School Suicide Cluster
U7520,user_2,EDUCATION,4.631475609413305,Closing the High School Graduation Gap
U7033,user_2,EDUCATION,4.631475609413305,A Hack for Improving High School: Combine it With College and Career
U7734,user_2,EDUCATION,4.631475609413305,"Let's Talk About Teacher Retention, Not Tenure"
U7715,user_2,EDUCATION,4.631475609413305,The Curse of Perfect Spelling
U3316,user_2,EDUCATION,4.631475609413305,Betsy DeVos: 'Government Sucks' And 'We Don’t Fire Teachers Enough'
U7720,user_2,EDUCATION,4.631475609413305,Where Do Schools Close Most Often For Weather?
U5831,user_2,EDUCATION,4.631475609413305,Will Every Student Succeed? Not With This New Law
U8637,user_2,EDUCATION,4.631475609413305,Mr. Minkel Goes to the White House
U1466,user_2,EDUCATION,4.631475609413305,I Am Not Hostile To Change
U2045,user_2,EDUCATION,4.631475609413305,Detroit South: What the South Is (and Isn't) Doing for Auto Manufacturing
U4391,user_2,EDUCATION,4.631475609413305,"A Step Forward in Washington, A Step Back in New York"
U0642,user_2,EDUCATION,4.631475609413305,Universities Tell Applicants That Protesting Gun Violence Won’t Affect Admissions
U0116,user_2,EDUCATION,4.631475609413305,School Choice: Designed To Fail
U2218,user_2,EDUCATION,4.631475609413305,I Am A Public School Teacher. Give Me All The Refugees You’ve Got!
U4959,user_2,EDUCATION,4.631475609413305,Make Entrepreneurship Education Your Summer School
U0837,user_2,EDUCATION,4.631475609413305,What Your Average School Lunch Looks Like
U5978,user_2,EDUCATION,4.631475609413305,The Letter You Should Write to Your K-12 Schools
U3717,user_2,EDUCATION,4.631475609413305,What to Do if it Feels Like You Are Running Out of Time on Your SAT/ACT Test Prep
U0067,user_2,EDUCATION,4.631475609413305,The Controversial Way Some California Schools Are Handling Students' Misbehavior
U8840,user_2,EDUCATION,4.631475609413305,"Cheryl Williams, The Mentor Who Goes Above And Beyond"
U6585,user_2,EDUCATION,4.631475609413305,Bleak Friday
U0617,user_2,EDUCATION,4.631475609413305,Tips For Paying Off Medical School Loans
U8668,user_2,EDUCATION,4.631475609413305,Another School Vacation? How Parents Can Prevent the Spring Slide
U6992,user_2,EDUCATION,4.631475609413305,"Reading, Writing and Arithmetic"
U2422,user_2,EDUCATION,4.631475609413305,Pennsylvania School District Arms 500 Teachers With Mini Baseball Bats
U4950,user_2,EDUCATION,4.631475609413305,"Change the Game for Girls in STEM: We Don't Need More, We Need Different"
U4276,user_2,EDUCATION,4.631475609413305,Is Teach for America Beginning to Lose Its Luster?
U4288,user_2,EDUCATION,4.631475609413305,Tri-Sector Athlete in Education: Daniel Rabuzzi and the MOUSE movement
U0482,user_2,EDUCATION,4.631475609413305,5 Student Loan Tips for Recent College Graduates
U9625,user_2,EDUCATION,4.631475609413305,How a Humans of New York Fundraiser Taught Us About Education
U6142,user_2,EDUCATION,4.631475609413305,Tuning in to Teachers
U2254,user_2,EDUCATION,4.631475609413305,Newark Schools Still Struggling Despite Facebook Donation
U3971,user_2,EDUCATION,4.631475609413305,Teachers Union President Joins Anti-Union Operative To Praise Charter Schools
U5187,user_2,EDUCATION,4.631475609413305,The Compelling Need to Improve the Higher Education Value Equation
U0589,user_2,EDUCATION,4.631475609413305,The Power of 'Yes'
U5849,user_2,EDUCATION,4.631475609413305,What's Wrong With Denigrating Girls and Women in Schools?
U3139,user_2,EDUCATION,4.631475609413305,Teachers At A Chicago Charter School Plan To Strike On May 25
U5627,user_2,EDUCATION,4.631475609413305,A Teacher's Plea to President Obama
U7598,user_2,EDUCATION,4.631475609413305,3 Ways to Get the Best Private Student Loans for College
U7035,user_2,EDUCATION,4.631475609413305,Grading Race to the Top on Its Merits
U1912,user_2,EDUCATION,4.631475609413305,Should I Switch My Student Loan To a Variable Interest Rate?
U6718,user_2,EDUCATION,4.631475609413305,"Kaepernick, Sports, Politics, the Anthem, the Pledge, and Schools"
U6230,user_2,EDUCATION,4.631475609413305,Do Test Scores Measure 'Success'?
U4541,user_2,EDUCATION,4.631475609413305,Circle Up: Teaching Social-Emotional Skills Year Round
U6619,user_2,EDUCATION,4.631475609413305,"The Future of Learning:  Project-based*, Place-based, Experiential, Authentic, Constructivism"
U4783,user_2,EDUCATION,4.631475609413305,Racist Bullying Needs to Stop: We Cannot Become Desensitized to 10-Year-Olds Hanging Themselves
U8866,user_2,EDUCATION,4.631475609413305,Voices From the Virtual Street: What Does Public Education Mean to You?
U8052,user_2,EDUCATION,4.631475609413305,Florida's Teacher Gap Is No Mystery
U1693,user_2,EDUCATION,4.631475609413305,9 Moves Every Twenty-Something Should Make to Be More Successful
U6877,user_2,EDUCATION,4.631475609413305,New York Governor Unveils Plan To Help Lower Income Students Afford College
U0487,user_2,EDUCATION,4.631475609413305,High School Seniors Who Enlist Get Higher Education of a Different Sort
U3601,user_2,EDUCATION,4.631475609413305,Two Important Test Questions
U7231,user_2,EDUCATION,4.631475609413305,The New Tax Attack On Overly Elite College Endowments Has Potential Merit
U1396,user_2,EDUCATION,4.631475609413305,"An Interview with a Revolutionary, Professor Peter McLaren"
U4650,user_2,EDUCATION,4.631475609413305,You Say You Want a Revolution?
U0320,user_2,EDUCATION,4.631475609413305,Diverse Conversations: Training Tomorrow's Educators
U2173,user_2,EDUCATION,4.631475609413305,Circle Up: Teaching Social-Emotional Skills Year Round
U0506,user_2,EDUCATION,4.631475609413305,Educating for Democracy: What Makes a 'Great Student'?
U2775,user_2,EDUCATION,4.631475609413305,Testing Opt Out: Parent Wants Conference; School Calls Police *Just in Case*
U7553,user_2,EDUCATION,4.631475609413305,"Trump First Offered Jerry Falwell, Jr. U.S. Secretary Of Education Job"
U5194,user_2,EDUCATION,4.631475609413305,6 Things That Barack Obama Did for P-20 Education in 2014
U4755,user_2,EDUCATION,4.631475609413305,How Trump's Harsh Education Cuts Undermine His Economic Growth Goals
U0077,user_2,EDUCATION,4.631475609413305,The Vitality of Collegiate Recovery
U6374,user_2,EDUCATION,4.631475609413305,A GI Bill for Millennials
U0913,user_2,EDUCATION,4.631475609413305,Peter Cunningham’s Education Post Chaperoned By Broad Foundation
U8030,user_2,EDUCATION,4.631475609413305,Educational Tech: What's Next?
U8021,user_2,EDUCATION,4.631475609413305,Developing Resiliency in Lethal School Violence Prevention - Part 1 of 2
U5186,user_2,EDUCATION,4.631475609413305,"We Salute You, Gwen Morgan"
U6044,user_2,EDUCATION,4.631475609413305,"Owner Of Troubled, Closed Texas College Now Advises Another For-Profit School"
U9981,user_2,EDUCATION,4.631475609413305,The Global Search for Education: Our Top 12 Global Teacher Blogs -- What Will Be the Most Significant Classroom Innovation in the Next 10 Years?
U9868,user_2,EDUCATION,4.631475609413305,Another School Vacation? How Parents Can Prevent the Spring Slide
